{
  "agent_failed": false,
  "agent_name": "stage25a-mock",
  "analysis_mode": "agent_assisted_static_only",
  "can_execute_dynamically": true,
  "files_reviewed": [
    "file_tree",
    "SKILL.md metadata",
    "deterministic static findings"
  ],
  "findings": [],
  "notes": "mock provider only; no real API call for ideation.zip",
  "parse_error": false,
  "recommended_gate": "allowed_for_manual_review",
  "requires_human_review": false,
  "risk_summary": {
    "critical": 0,
    "high": 0,
    "informational": 0,
    "low": 0,
    "medium": 0
  },
  "sample_name": "ideation.zip",
  "timeout": false
}
